{
  "$schema": "https://json-schema.org/draft/2020-12/schema",
  "title": "EstimatorTable",
  "description": "Shape of packages/spec/estimator.json, the run estimator's fitted coefficients (ARCHITECTURE.md, Estimator; ADR-049). Written by worker/benchmarks/solver/fit.py from the benchmark data; never edited by hand. Every quantity is SI: bytes and seconds.",
  "type": "object",
  "additionalProperties": false,
  "required": ["version", "source", "analyses", "memoryMargin", "usableMemoryFraction", "limitMemoryBytes"],
  "properties": {
    "version": {
      "description": "Bumped whenever a coefficient changes, so a run's frozen estimate says which fit made it.",
      "type": "integer",
      "minimum": 1
    },
    "source": { "description": "Where the fit's data came from, for people.", "type": "string" },
    "analyses": {
      "description": "One model per analysis type a run can have.",
      "type": "object",
      "additionalProperties": false,
      "required": ["linear_static"],
      "properties": {
        "linear_static": { "$ref": "#/$defs/SolverModels" }
      }
    },
    "memoryMargin": {
      "description": "Factor on the fitted peak memory that a machine size must hold before it is recommended. Recommendations are conservative on memory, because the platform pays when its recommendation is too small (ARCHITECTURE.md).",
      "type": "number",
      "minimum": 1
    },
    "usableMemoryFraction": {
      "description": "Share of a machine size's memory the solver may use; the rest is left to the system and the worker.",
      "type": "number",
      "exclusiveMinimum": 0,
      "maximum": 1
    },
    "limitMemoryBytes": {
      "description": "Memory of the machine the element limits are for (ADR-058): 16 GiB in Phase 0. A run whose mesh has more elements than its solver's limit is refused.",
      "type": "integer",
      "minimum": 1
    }
  },
  "$defs": {
    "SolverModels": {
      "description": "One model per equation solver a run can use (ADR-058), keyed as SimulationSpec's solver.",
      "type": "object",
      "additionalProperties": false,
      "required": ["pastix", "spooles", "iterative_cholesky", "iterative_scaling"],
      "properties": {
        "pastix": { "$ref": "#/$defs/AnalysisModel" },
        "spooles": { "$ref": "#/$defs/AnalysisModel" },
        "iterative_cholesky": { "$ref": "#/$defs/AnalysisModel" },
        "iterative_scaling": { "$ref": "#/$defs/AnalysisModel" }
      }
    },
    "AnalysisModel": {
      "type": "object",
      "additionalProperties": false,
      "required": ["solver", "peakMemoryBytes", "jobSeconds", "fittedNodes", "maxElements"],
      "properties": {
        "solver": { "description": "The solver and threads the fit was measured with.", "type": "string" },
        "peakMemoryBytes": {
          "description": "Peak resident memory of the solver process.",
          "$ref": "#/$defs/PowerLaw"
        },
        "jobSeconds": {
          "description": "Wall time of the solve job's billable phase: writing the deck, the solver, reading results and writing the viewer's files.",
          "$ref": "#/$defs/PowerLaw"
        },
        "fittedNodes": {
          "description": "Smallest and largest node count among the measurements; outside this range the estimate is an extrapolation.",
          "type": "array",
          "items": { "type": "integer", "minimum": 1 },
          "minItems": 2,
          "maxItems": 2
        },
        "maxElements": {
          "description": "Largest element count a run with this solver may have, per element order, on a machine of limitMemoryBytes: the node count whose fitted peak memory times memoryMargin fits in usableMemoryFraction of it, turned into elements with the nodes per element of the measured mesh nearest it, at most the largest mesh measured, rounded down to a thousand.",
          "type": "object",
          "additionalProperties": false,
          "required": ["order1", "order2"],
          "properties": {
            "order1": { "description": "Four-node tetrahedra.", "type": "integer", "minimum": 1 },
            "order2": { "description": "Ten-node tetrahedra.", "type": "integer", "minimum": 1 }
          }
        }
      }
    },
    "PowerLaw": {
      "description": "constant + coefficient * nodes ^ exponent, where nodes is the mesh's node count.",
      "type": "object",
      "additionalProperties": false,
      "required": ["constant", "coefficient", "exponent", "largestRatio"],
      "properties": {
        "constant": { "type": "number", "minimum": 0 },
        "coefficient": { "type": "number", "exclusiveMinimum": 0 },
        "exponent": { "type": "number", "exclusiveMinimum": 0 },
        "largestRatio": {
          "description": "Largest measured value over the fitted one among the measurements: how far the fit fell short at worst.",
          "type": "number",
          "exclusiveMinimum": 0
        }
      }
    }
  }
}
